{
  "schema_version": 1,
  "before": {
    "file": "base.e2k",
    "program": "ETABS",
    "program_version": "20.3.0",
    "file_units": {
      "force": "KIP",
      "length": "FT",
      "temperature": "F"
    }
  },
  "after": {
    "file": "revised.e2k",
    "program": "ETABS",
    "program_version": "20.3.0",
    "file_units": {
      "force": "KIP",
      "length": "FT",
      "temperature": "F"
    }
  },
  "units": {
    "force": "KIP",
    "length": "FT",
    "temperature": "F"
  },
  "tolerances": {
    "match": 0.01,
    "rel": 1e-05,
    "abs": 1e-09
  },
  "stories": {
    "before": [
      {
        "name": "BASE",
        "elev": 0.0,
        "height": null
      },
      {
        "name": "L2",
        "elev": 14.0,
        "height": 14.0
      },
      {
        "name": "L3",
        "elev": 26.0,
        "height": 12.0
      },
      {
        "name": "ROOF",
        "elev": 38.0,
        "height": 12.0
      }
    ],
    "after": [
      {
        "name": "BASE",
        "elev": 0.0,
        "height": null
      },
      {
        "name": "L2",
        "elev": 14.0,
        "height": 14.0
      },
      {
        "name": "L3",
        "elev": 26.0,
        "height": 12.0
      },
      {
        "name": "ROOF",
        "elev": 38.0,
        "height": 12.0
      }
    ]
  },
  "summary": {
    "point": {
      "unchanged": 26,
      "added": 4,
      "removed": 2,
      "modified": 0,
      "relabeled": 0
    },
    "frame": {
      "unchanged": 41,
      "added": 2,
      "removed": 2,
      "modified": 1,
      "relabeled": 3
    },
    "area": {
      "unchanged": 6,
      "added": 0,
      "removed": 0,
      "modified": 1,
      "relabeled": 0
    },
    "definitions": {
      "added": 1,
      "removed": 0,
      "modified": 1
    }
  },
  "objects": [
    {
      "kind": "area",
      "status": "unchanged",
      "type": "FLOOR",
      "before_id": "F1@L2",
      "after_id": "F1@L2",
      "label": "F1",
      "story": "L2",
      "coords": [
        [0.0, 0.0, 14.0],
        [25.0, 0.0, 14.0],
        [25.0, 30.0, 14.0],
        [0.0, 30.0, 14.0]
      ],
      "section": "SLAB8",
      "offset": 0.0,
      "changes": []
    },
    {
      "kind": "area",
      "status": "unchanged",
      "type": "FLOOR",
      "before_id": "F1@L3",
      "after_id": "F1@L3",
      "label": "F1",
      "story": "L3",
      "coords": [
        [0.0, 0.0, 26.0],
        [25.0, 0.0, 26.0],
        [25.0, 30.0, 26.0],
        [0.0, 30.0, 26.0]
      ],
      "section": "SLAB8",
      "offset": 0.0,
      "changes": []
    },
    {
      "kind": "area",
      "status": "unchanged",
      "type": "FLOOR",
      "before_id": "F1@ROOF",
      "after_id": "F1@ROOF",
      "label": "F1",
      "story": "ROOF",
      "coords": [
        [0.0, 0.0, 38.0],
        [25.0, 0.0, 38.0],
        [25.0, 30.0, 38.0],
        [0.0, 30.0, 38.0]
      ],
      "section": "SLAB8",
      "offset": 0.0,
      "changes": []
    },
    {
      "kind": "area",
      "status": "modified",
      "type": "FLOOR",
      "before_id": "F2@L2",
      "after_id": "F2@L2",
      "label": "F2",
      "story": "L2",
      "coords": [
        [25.0, 0.0, 14.0],
        [50.0, 0.0, 14.0],
        [50.0, 30.0, 14.0],
        [25.0, 30.0, 14.0]
      ],
      "section": "SLAB8",
      "offset": 0.0,
      "changes": [
        {
          "field": "loads.LIVE",
          "before": [
            {
              "TYPE": "UNIFF",
              "DIR": "GRAV",
              "FVAL": 0.05
            }
          ],
          "after": [
            {
              "TYPE": "UNIFF",
              "DIR": "GRAV",
              "FVAL": 0.125
            }
          ]
        }
      ]
    },
    {
      "kind": "area",
      "status": "unchanged",
      "type": "FLOOR",
      "before_id": "F2@L3",
      "after_id": "F2@L3",
      "label": "F2",
      "story": "L3",
      "coords": [
        [25.0, 0.0, 26.0],
        [50.0, 0.0, 26.0],
        [50.0, 30.0, 26.0],
        [25.0, 30.0, 26.0]
      ],
      "section": "SLAB8",
      "offset": 0.0,
      "changes": []
    },
    {
      "kind": "area",
      "status": "unchanged",
      "type": "FLOOR",
      "before_id": "F2@ROOF",
      "after_id": "F2@ROOF",
      "label": "F2",
      "story": "ROOF",
      "coords": [
        [25.0, 0.0, 38.0],
        [50.0, 0.0, 38.0],
        [50.0, 30.0, 38.0],
        [25.0, 30.0, 38.0]
      ],
      "section": "SLAB8",
      "offset": 0.0,
      "changes": []
    },
    {
      "kind": "area",
      "status": "unchanged",
      "type": "PANEL",
      "before_id": "W1@L2",
      "after_id": "W1@L2",
      "label": "W1",
      "story": "L2",
      "coords": [
        [50.0, 0.0, 0.0],
        [50.0, 30.0, 0.0],
        [50.0, 30.0, 14.0],
        [50.0, 0.0, 14.0]
      ],
      "section": "WALL12",
      "offset": 0.0,
      "changes": []
    },
    {
      "kind": "frame",
      "status": "added",
      "type": "BEAM",
      "before_id": null,
      "after_id": "B10@L2",
      "label": "B10",
      "story": "L2",
      "coords": [
        [25.0, 22.0, 14.0],
        [50.0, 22.0, 14.0]
      ],
      "section": "W18X35",
      "offset": null,
      "changes": []
    },
    {
      "kind": "frame",
      "status": "removed",
      "type": "BEAM",
      "before_id": "B10@L2",
      "after_id": null,
      "label": "B10",
      "story": "L2",
      "coords": [
        [25.0, 20.0, 14.0],
        [50.0, 20.0, 14.0]
      ],
      "section": "W18X35",
      "offset": null,
      "changes": []
    },
    {
      "kind": "frame",
      "status": "unchanged",
      "type": "BEAM",
      "before_id": "B1@L2",
      "after_id": "B1@L2",
      "label": "B1",
      "story": "L2",
      "coords": [
        [0.0, 0.0, 14.0],
        [25.0, 0.0, 14.0]
      ],
      "section": "W18X35",
      "offset": 0.0,
      "changes": []
    },
    {
      "kind": "frame",
      "status": "unchanged",
      "type": "BEAM",
      "before_id": "B1@L3",
      "after_id": "B1@L3",
      "label": "B1",
      "story": "L3",
      "coords": [
        [0.0, 0.0, 26.0],
        [25.0, 0.0, 26.0]
      ],
      "section": "W18X35",
      "offset": 0.0,
      "changes": []
    },
    {
      "kind": "frame",
      "status": "unchanged",
      "type": "BEAM",
      "before_id": "B1@ROOF",
      "after_id": "B1@ROOF",
      "label": "B1",
      "story": "ROOF",
      "coords": [
        [0.0, 0.0, 38.0],
        [25.0, 0.0, 38.0]
      ],
      "section": "W18X35",
      "offset": 0.0,
      "changes": []
    },
    {
      "kind": "frame",
      "status": "unchanged",
      "type": "BEAM",
      "before_id": "B2@L2",
      "after_id": "B2@L2",
      "label": "B2",
      "story": "L2",
      "coords": [
        [25.0, 0.0, 14.0],
        [50.0, 0.0, 14.0]
      ],
      "section": "W18X35",
      "offset": 0.0,
      "changes": []
    },
    {
      "kind": "frame",
      "status": "modified",
      "type": "BEAM",
      "before_id": "B2@L3",
      "after_id": "B2@L3",
      "label": "B2",
      "story": "L3",
      "coords": [
        [25.0, 0.0, 26.0],
        [50.0, 0.0, 26.0]
      ],
      "section": "W24X55",
      "offset": 0.0,
      "changes": [
        {
          "field": "assigns.SECTION",
          "before": "W18X35",
          "after": "W24X55"
        }
      ]
    },
    {
      "kind": "frame",
      "status": "unchanged",
      "type": "BEAM",
      "before_id": "B2@ROOF",
      "after_id": "B2@ROOF",
      "label": "B2",
      "story": "ROOF",
      "coords": [
        [25.0, 0.0, 38.0],
        [50.0, 0.0, 38.0]
      ],
      "section": "W18X35",
      "offset": 0.0,
      "changes": []
    },
    {
      "kind": "frame",
      "status": "unchanged",
      "type": "BEAM",
      "before_id": "B3@L2",
      "after_id": "B3@L2",
      "label": "B3",
      "story": "L2",
      "coords": [
        [0.0, 30.0, 14.0],
        [25.0, 30.0, 14.0]
      ],
      "section": "W18X35",
      "offset": 0.0,
      "changes": []
    },
    {
      "kind": "frame",
      "status": "unchanged",
      "type": "BEAM",
      "before_id": "B3@L3",
      "after_id": "B3@L3",
      "label": "B3",
      "story": "L3",
      "coords": [
        [0.0, 30.0, 26.0],
        [25.0, 30.0, 26.0]
      ],
      "section": "W18X35",
      "offset": 0.0,
      "changes": []
    },
    {
      "kind": "frame",
      "status": "unchanged",
      "type": "BEAM",
      "before_id": "B3@ROOF",
      "after_id": "B3@ROOF",
      "label": "B3",
      "story": "ROOF",
      "coords": [
        [0.0, 30.0, 38.0],
        [25.0, 30.0, 38.0]
      ],
      "section": "W18X35",
      "offset": 0.0,
      "changes": []
    },
    {
      "kind": "frame",
      "status": "unchanged",
      "type": "BEAM",
      "before_id": "B4@L2",
      "after_id": "B4@L2",
      "label": "B4",
      "story": "L2",
      "coords": [
        [25.0, 30.0, 14.0],
        [50.0, 30.0, 14.0]
      ],
      "section": "W18X35",
      "offset": 0.0,
      "changes": []
    },
    {
      "kind": "frame",
      "status": "unchanged",
      "type": "BEAM",
      "before_id": "B4@L3",
      "after_id": "B4@L3",
      "label": "B4",
      "story": "L3",
      "coords": [
        [25.0, 30.0, 26.0],
        [50.0, 30.0, 26.0]
      ],
      "section": "W18X35",
      "offset": 0.0,
      "changes": []
    },
    {
      "kind": "frame",
      "status": "unchanged",
      "type": "BEAM",
      "before_id": "B4@ROOF",
      "after_id": "B4@ROOF",
      "label": "B4",
      "story": "ROOF",
      "coords": [
        [25.0, 30.0, 38.0],
        [50.0, 30.0, 38.0]
      ],
      "section": "W18X35",
      "offset": 0.0,
      "changes": []
    },
    {
      "kind": "frame",
      "status": "unchanged",
      "type": "BEAM",
      "before_id": "B5@L2",
      "after_id": "B5@L2",
      "label": "B5",
      "story": "L2",
      "coords": [
        [0.0, 0.0, 14.0],
        [0.0, 30.0, 14.0]
      ],
      "section": "W21X44",
      "offset": 0.0,